{
  "schemaVersion": 1,
  "contextId": "scout-cb3825cf6717d6d9f3cc099f",
  "task": {
    "taskId": "CLEW-123",
    "projectId": "PROJECT-CLEW",
    "contractFingerprint": "0733e16d33c72a786a2a87a1095daeb8e423c97aa5d04884a059a728e9e61675"
  },
  "source": {
    "repositoryId": "clew",
    "revision": "0123456789abcdef0123456789abcdef01234567",
    "scope": {
      "paths": ["src", "test"]
    },
    "generatedAt": "2026-09-11T10:00:00.000Z",
    "attemptId": "attempt-123"
  },
  "components": [
    {
      "id": "domain",
      "path": "src/domain.js",
      "symbol": "validateTaskContract",
      "purpose": "Validates and normalizes the public Task Contract.",
      "references": [
        {
          "path": "src/domain.js",
          "revision": "0123456789abcdef0123456789abcdef01234567",
          "lineStart": 268,
          "lineEnd": 360
        }
      ]
    },
    {
      "id": "tests",
      "path": "test/domain.test.js",
      "purpose": "Covers Task Contract runtime behavior.",
      "references": [
        {
          "path": "test/domain.test.js",
          "revision": "0123456789abcdef0123456789abcdef01234567",
          "lineStart": 1,
          "lineEnd": 170
        }
      ]
    }
  ],
  "relationships": [
    {
      "sourceComponentId": "tests",
      "targetComponentId": "domain",
      "kind": "verifies",
      "description": "Domain tests exercise the Task Contract validator.",
      "references": [
        {
          "path": "test/domain.test.js",
          "revision": "0123456789abcdef0123456789abcdef01234567",
          "lineStart": 1,
          "lineEnd": 170
        }
      ]
    }
  ],
  "checks": [
    {
      "kind": "recommended",
      "command": "node",
      "args": ["--test", "test/scout-context.test.js"],
      "cwd": ".",
      "reason": "Exercises the RepositoryContext contract without running it during scouting.",
      "references": [
        {
          "path": "package.json",
          "revision": "0123456789abcdef0123456789abcdef01234567",
          "lineStart": 1,
          "lineEnd": 45
        }
      ]
    }
  ],
  "observations": [
    {
      "kind": "observed",
      "statement": "Task contracts are normalized by validateTaskContract.",
      "references": [
        {
          "path": "src/domain.js",
          "revision": "0123456789abcdef0123456789abcdef01234567",
          "lineStart": 268,
          "lineEnd": 360
        }
      ]
    },
    {
      "kind": "inferred",
      "statement": "Future consumers can compare the public contract fingerprint before reuse.",
      "references": [
        {
          "path": "src/domain.js",
          "revision": "0123456789abcdef0123456789abcdef01234567",
          "lineStart": 268,
          "lineEnd": 360
        }
      ]
    }
  ],
  "unknowns": [
    {
      "question": "Which harness will be selected for the first live scout run?",
      "reason": "Harness selection belongs to CLEW-124.",
      "references": []
    }
  ],
  "omissions": [],
  "provenance": {
    "status": "complete",
    "runtime": {
      "harness": "fake",
      "sessionId": "session-123"
    },
    "checksum": "5c76837e0c7f137a79994fd969d64939df2160c2eff3b901ad10bac9a578af30"
  }
}
